{
  "version": {
    "major": 0,
    "minor": 0
  },
  "family": "publish-execution-state",
  "requestId": "req-1",
  "kind": "notification",
  "payload": {
    "sessionId": "debug-1",
    "context": {
      "workspaceId": "workspace-a",
      "projectId": "app",
      "compilationContextId": "ctx-3",
      "snapshot": {
        "hostId": "host-a",
        "documentUri": "workspace://sample/Counter.cs",
        "hostVersion": "v8",
        "snapshotId": "s8"
      }
    },
    "sourceGeneration": "build-4",
    "state": "running",
    "evidenceKind": "debugger",
    "capabilities": [
      "step"
    ]
  },
  "extensions": {}
}
